CREATE TABLE bug51920 (i INT) ENGINE=InnoDB;
INSERT INTO bug51920 VALUES (1);
BEGIN;
SELECT * FROM bug51920 FOR UPDATE;
i
1
UPDATE bug51920 SET i=2;
SET @thread_id= ID;
KILL @thread_id;
SELECT sleep(2);
sleep(2)
0
SELECT * FROM DATA_DICTIONARY.PROCESSLIST WHERE ID=@thread_id;
ID	USER	HOST	DB	COMMAND	TIME	STATE	INFO
Got one of the listed errors
DROP TABLE bug51920;
