DROP TABLE IF EXISTS t1;
CREATE TABLE t1 (a INT, b VARCHAR(20)) ENGINE=FILESYSTEM,FILE="VARDIR/filesystem_ln/basic_delete.data";
INSERT INTO t1 VALUES (222, "bbb");
INSERT INTO t1 VALUES (333, "ccc");
INSERT INTO t1 VALUES (444, "ddd");
INSERT INTO t1 VALUES (555, "eee");
INSERT INTO t1 VALUES (666, "fff");
SELECT * FROM t1;
a	b
111	aaa
222	bbb
333	ccc
444	ddd
555	eee
666	fff
DELETE FROM t1 WHERE a>=444;
DELETE FROM t1 WHERE b="bbb";
DELETE FROM t1 WHERE a!=111;
SELECT * FROM t1;
a	b
111	aaa
DROP TABLE t1;
