SELECT 1;
1
1
CREATE SCHEMA drizzleslap;
USE drizzleslap;
CREATE TABLE bench1 (field_search SERIAL, field1 int DEFAULT 1, field2 int DEFAULT 1, field3 int DEFAULT 1, field4 int DEFAULT 1, field5 int DEFAULT 1);
INSERT INTO bench1 (field1, field2, field3, field4, field5) SELECT value, value, value, value, value from data_dictionary.random_number LIMIT 255;
UPDATE bench1 SET field5=1 WHERE field_search=1;
UPDATE bench1 SET field5=1 WHERE field_search=2;
UPDATE bench1 SET field5=1 WHERE field_search=3;
UPDATE bench1 SET field5=1 WHERE field_search=4;
UPDATE bench1 SET field5=1 WHERE field_search=5;
UPDATE bench1 SET field5=1 WHERE field_search=6;
UPDATE bench1 SET field5=1 WHERE field_search=7;
UPDATE bench1 SET field5=1 WHERE field_search=8;
UPDATE bench1 SET field5=1 WHERE field_search=9;
UPDATE bench1 SET field5=1 WHERE field_search=10;
UPDATE bench1 SET field5=1 WHERE field_search=11;
UPDATE bench1 SET field5=1 WHERE field_search=12;
UPDATE bench1 SET field5=1 WHERE field_search=13;
UPDATE bench1 SET field5=1 WHERE field_search=14;
UPDATE bench1 SET field5=1 WHERE field_search=15;
UPDATE bench1 SET field5=1 WHERE field_search=16;
UPDATE bench1 SET field5=1 WHERE field_search=17;
UPDATE bench1 SET field5=1 WHERE field_search=18;
UPDATE bench1 SET field5=1 WHERE field_search=19;
UPDATE bench1 SET field5=1 WHERE field_search=20;
UPDATE bench1 SET field5=1 WHERE field_search=21;
UPDATE bench1 SET field5=1 WHERE field_search=22;
UPDATE bench1 SET field5=1 WHERE field_search=23;
UPDATE bench1 SET field5=1 WHERE field_search=24;
UPDATE bench1 SET field5=1 WHERE field_search=25;
UPDATE bench1 SET field5=1 WHERE field_search=26;
UPDATE bench1 SET field5=1 WHERE field_search=27;
UPDATE bench1 SET field5=1 WHERE field_search=28;
UPDATE bench1 SET field5=1 WHERE field_search=29;
UPDATE bench1 SET field5=1 WHERE field_search=30;
UPDATE bench1 SET field5=1 WHERE field_search=31;
UPDATE bench1 SET field5=1 WHERE field_search=32;
UPDATE bench1 SET field5=1 WHERE field_search=33;
UPDATE bench1 SET field5=1 WHERE field_search=34;
UPDATE bench1 SET field5=1 WHERE field_search=35;
UPDATE bench1 SET field5=1 WHERE field_search=36;
UPDATE bench1 SET field5=1 WHERE field_search=37;
UPDATE bench1 SET field5=1 WHERE field_search=38;
UPDATE bench1 SET field5=1 WHERE field_search=39;
UPDATE bench1 SET field5=1 WHERE field_search=40;
UPDATE bench1 SET field5=1 WHERE field_search=41;
UPDATE bench1 SET field5=1 WHERE field_search=42;
UPDATE bench1 SET field5=1 WHERE field_search=43;
UPDATE bench1 SET field5=1 WHERE field_search=44;
UPDATE bench1 SET field5=1 WHERE field_search=45;
UPDATE bench1 SET field5=1 WHERE field_search=46;
UPDATE bench1 SET field5=1 WHERE field_search=47;
UPDATE bench1 SET field5=1 WHERE field_search=48;
UPDATE bench1 SET field5=1 WHERE field_search=49;
UPDATE bench1 SET field5=1 WHERE field_search=50;
UPDATE bench1 SET field5=1 WHERE field_search=51;
UPDATE bench1 SET field5=1 WHERE field_search=52;
UPDATE bench1 SET field5=1 WHERE field_search=53;
UPDATE bench1 SET field5=1 WHERE field_search=54;
UPDATE bench1 SET field5=1 WHERE field_search=55;
UPDATE bench1 SET field5=1 WHERE field_search=56;
UPDATE bench1 SET field5=1 WHERE field_search=57;
UPDATE bench1 SET field5=1 WHERE field_search=58;
UPDATE bench1 SET field5=1 WHERE field_search=59;
UPDATE bench1 SET field5=1 WHERE field_search=60;
UPDATE bench1 SET field5=1 WHERE field_search=61;
UPDATE bench1 SET field5=1 WHERE field_search=62;
UPDATE bench1 SET field5=1 WHERE field_search=63;
UPDATE bench1 SET field5=1 WHERE field_search=64;
UPDATE bench1 SET field5=1 WHERE field_search=65;
UPDATE bench1 SET field5=1 WHERE field_search=66;
UPDATE bench1 SET field5=1 WHERE field_search=67;
UPDATE bench1 SET field5=1 WHERE field_search=68;
UPDATE bench1 SET field5=1 WHERE field_search=69;
UPDATE bench1 SET field5=1 WHERE field_search=70;
UPDATE bench1 SET field5=1 WHERE field_search=71;
UPDATE bench1 SET field5=1 WHERE field_search=72;
UPDATE bench1 SET field5=1 WHERE field_search=73;
UPDATE bench1 SET field5=1 WHERE field_search=74;
UPDATE bench1 SET field5=1 WHERE field_search=75;
UPDATE bench1 SET field5=1 WHERE field_search=76;
UPDATE bench1 SET field5=1 WHERE field_search=77;
UPDATE bench1 SET field5=1 WHERE field_search=78;
UPDATE bench1 SET field5=1 WHERE field_search=79;
UPDATE bench1 SET field5=1 WHERE field_search=80;
UPDATE bench1 SET field5=1 WHERE field_search=81;
UPDATE bench1 SET field5=1 WHERE field_search=82;
UPDATE bench1 SET field5=1 WHERE field_search=83;
UPDATE bench1 SET field5=1 WHERE field_search=84;
UPDATE bench1 SET field5=1 WHERE field_search=85;
UPDATE bench1 SET field5=1 WHERE field_search=86;
UPDATE bench1 SET field5=1 WHERE field_search=87;
UPDATE bench1 SET field5=1 WHERE field_search=88;
UPDATE bench1 SET field5=1 WHERE field_search=89;
UPDATE bench1 SET field5=1 WHERE field_search=90;
UPDATE bench1 SET field5=1 WHERE field_search=91;
UPDATE bench1 SET field5=1 WHERE field_search=92;
UPDATE bench1 SET field5=1 WHERE field_search=93;
UPDATE bench1 SET field5=1 WHERE field_search=94;
UPDATE bench1 SET field5=1 WHERE field_search=95;
UPDATE bench1 SET field5=1 WHERE field_search=96;
UPDATE bench1 SET field5=1 WHERE field_search=97;
UPDATE bench1 SET field5=1 WHERE field_search=98;
UPDATE bench1 SET field5=1 WHERE field_search=99;
UPDATE bench1 SET field5=1 WHERE field_search=100;
UPDATE bench1 SET field5=1 WHERE field_search=101;
UPDATE bench1 SET field5=1 WHERE field_search=102;
UPDATE bench1 SET field5=1 WHERE field_search=103;
UPDATE bench1 SET field5=1 WHERE field_search=104;
UPDATE bench1 SET field5=1 WHERE field_search=105;
UPDATE bench1 SET field5=1 WHERE field_search=106;
UPDATE bench1 SET field5=1 WHERE field_search=107;
UPDATE bench1 SET field5=1 WHERE field_search=108;
UPDATE bench1 SET field5=1 WHERE field_search=109;
UPDATE bench1 SET field5=1 WHERE field_search=110;
UPDATE bench1 SET field5=1 WHERE field_search=111;
UPDATE bench1 SET field5=1 WHERE field_search=112;
UPDATE bench1 SET field5=1 WHERE field_search=113;
UPDATE bench1 SET field5=1 WHERE field_search=114;
UPDATE bench1 SET field5=1 WHERE field_search=115;
UPDATE bench1 SET field5=1 WHERE field_search=116;
UPDATE bench1 SET field5=1 WHERE field_search=117;
UPDATE bench1 SET field5=1 WHERE field_search=118;
UPDATE bench1 SET field5=1 WHERE field_search=119;
UPDATE bench1 SET field5=1 WHERE field_search=120;
UPDATE bench1 SET field5=1 WHERE field_search=121;
UPDATE bench1 SET field5=1 WHERE field_search=122;
UPDATE bench1 SET field5=1 WHERE field_search=123;
UPDATE bench1 SET field5=1 WHERE field_search=124;
UPDATE bench1 SET field5=1 WHERE field_search=125;
UPDATE bench1 SET field5=1 WHERE field_search=126;
UPDATE bench1 SET field5=1 WHERE field_search=127;
UPDATE bench1 SET field5=1 WHERE field_search=128;
UPDATE bench1 SET field5=1 WHERE field_search=129;
UPDATE bench1 SET field5=1 WHERE field_search=130;
UPDATE bench1 SET field5=1 WHERE field_search=131;
UPDATE bench1 SET field5=1 WHERE field_search=132;
UPDATE bench1 SET field5=1 WHERE field_search=133;
UPDATE bench1 SET field5=1 WHERE field_search=134;
UPDATE bench1 SET field5=1 WHERE field_search=135;
UPDATE bench1 SET field5=1 WHERE field_search=136;
UPDATE bench1 SET field5=1 WHERE field_search=137;
UPDATE bench1 SET field5=1 WHERE field_search=138;
UPDATE bench1 SET field5=1 WHERE field_search=139;
UPDATE bench1 SET field5=1 WHERE field_search=140;
UPDATE bench1 SET field5=1 WHERE field_search=141;
UPDATE bench1 SET field5=1 WHERE field_search=142;
UPDATE bench1 SET field5=1 WHERE field_search=143;
UPDATE bench1 SET field5=1 WHERE field_search=144;
UPDATE bench1 SET field5=1 WHERE field_search=145;
UPDATE bench1 SET field5=1 WHERE field_search=146;
UPDATE bench1 SET field5=1 WHERE field_search=147;
UPDATE bench1 SET field5=1 WHERE field_search=148;
UPDATE bench1 SET field5=1 WHERE field_search=149;
UPDATE bench1 SET field5=1 WHERE field_search=150;
UPDATE bench1 SET field5=1 WHERE field_search=151;
UPDATE bench1 SET field5=1 WHERE field_search=152;
UPDATE bench1 SET field5=1 WHERE field_search=153;
UPDATE bench1 SET field5=1 WHERE field_search=154;
UPDATE bench1 SET field5=1 WHERE field_search=155;
UPDATE bench1 SET field5=1 WHERE field_search=156;
UPDATE bench1 SET field5=1 WHERE field_search=157;
UPDATE bench1 SET field5=1 WHERE field_search=158;
UPDATE bench1 SET field5=1 WHERE field_search=159;
UPDATE bench1 SET field5=1 WHERE field_search=160;
UPDATE bench1 SET field5=1 WHERE field_search=161;
UPDATE bench1 SET field5=1 WHERE field_search=162;
UPDATE bench1 SET field5=1 WHERE field_search=163;
UPDATE bench1 SET field5=1 WHERE field_search=164;
UPDATE bench1 SET field5=1 WHERE field_search=165;
UPDATE bench1 SET field5=1 WHERE field_search=166;
UPDATE bench1 SET field5=1 WHERE field_search=167;
UPDATE bench1 SET field5=1 WHERE field_search=168;
UPDATE bench1 SET field5=1 WHERE field_search=169;
UPDATE bench1 SET field5=1 WHERE field_search=170;
UPDATE bench1 SET field5=1 WHERE field_search=171;
UPDATE bench1 SET field5=1 WHERE field_search=172;
UPDATE bench1 SET field5=1 WHERE field_search=173;
UPDATE bench1 SET field5=1 WHERE field_search=174;
UPDATE bench1 SET field5=1 WHERE field_search=175;
UPDATE bench1 SET field5=1 WHERE field_search=176;
UPDATE bench1 SET field5=1 WHERE field_search=177;
UPDATE bench1 SET field5=1 WHERE field_search=178;
UPDATE bench1 SET field5=1 WHERE field_search=179;
UPDATE bench1 SET field5=1 WHERE field_search=180;
UPDATE bench1 SET field5=1 WHERE field_search=181;
UPDATE bench1 SET field5=1 WHERE field_search=182;
UPDATE bench1 SET field5=1 WHERE field_search=183;
UPDATE bench1 SET field5=1 WHERE field_search=184;
UPDATE bench1 SET field5=1 WHERE field_search=185;
UPDATE bench1 SET field5=1 WHERE field_search=186;
UPDATE bench1 SET field5=1 WHERE field_search=187;
UPDATE bench1 SET field5=1 WHERE field_search=188;
UPDATE bench1 SET field5=1 WHERE field_search=189;
UPDATE bench1 SET field5=1 WHERE field_search=190;
UPDATE bench1 SET field5=1 WHERE field_search=191;
UPDATE bench1 SET field5=1 WHERE field_search=192;
UPDATE bench1 SET field5=1 WHERE field_search=193;
UPDATE bench1 SET field5=1 WHERE field_search=194;
UPDATE bench1 SET field5=1 WHERE field_search=195;
UPDATE bench1 SET field5=1 WHERE field_search=196;
UPDATE bench1 SET field5=1 WHERE field_search=197;
UPDATE bench1 SET field5=1 WHERE field_search=198;
UPDATE bench1 SET field5=1 WHERE field_search=199;
UPDATE bench1 SET field5=1 WHERE field_search=200;
UPDATE bench1 SET field5=1 WHERE field_search=201;
UPDATE bench1 SET field5=1 WHERE field_search=202;
UPDATE bench1 SET field5=1 WHERE field_search=203;
UPDATE bench1 SET field5=1 WHERE field_search=204;
UPDATE bench1 SET field5=1 WHERE field_search=205;
UPDATE bench1 SET field5=1 WHERE field_search=206;
UPDATE bench1 SET field5=1 WHERE field_search=207;
UPDATE bench1 SET field5=1 WHERE field_search=208;
UPDATE bench1 SET field5=1 WHERE field_search=209;
UPDATE bench1 SET field5=1 WHERE field_search=210;
UPDATE bench1 SET field5=1 WHERE field_search=211;
UPDATE bench1 SET field5=1 WHERE field_search=212;
UPDATE bench1 SET field5=1 WHERE field_search=213;
UPDATE bench1 SET field5=1 WHERE field_search=214;
UPDATE bench1 SET field5=1 WHERE field_search=215;
UPDATE bench1 SET field5=1 WHERE field_search=216;
UPDATE bench1 SET field5=1 WHERE field_search=217;
UPDATE bench1 SET field5=1 WHERE field_search=218;
UPDATE bench1 SET field5=1 WHERE field_search=219;
UPDATE bench1 SET field5=1 WHERE field_search=220;
UPDATE bench1 SET field5=1 WHERE field_search=221;
UPDATE bench1 SET field5=1 WHERE field_search=222;
UPDATE bench1 SET field5=1 WHERE field_search=223;
UPDATE bench1 SET field5=1 WHERE field_search=224;
UPDATE bench1 SET field5=1 WHERE field_search=225;
UPDATE bench1 SET field5=1 WHERE field_search=226;
UPDATE bench1 SET field5=1 WHERE field_search=227;
UPDATE bench1 SET field5=1 WHERE field_search=228;
UPDATE bench1 SET field5=1 WHERE field_search=229;
UPDATE bench1 SET field5=1 WHERE field_search=230;
UPDATE bench1 SET field5=1 WHERE field_search=231;
UPDATE bench1 SET field5=1 WHERE field_search=232;
UPDATE bench1 SET field5=1 WHERE field_search=233;
UPDATE bench1 SET field5=1 WHERE field_search=234;
UPDATE bench1 SET field5=1 WHERE field_search=235;
UPDATE bench1 SET field5=1 WHERE field_search=236;
UPDATE bench1 SET field5=1 WHERE field_search=237;
UPDATE bench1 SET field5=1 WHERE field_search=238;
UPDATE bench1 SET field5=1 WHERE field_search=239;
UPDATE bench1 SET field5=1 WHERE field_search=240;
UPDATE bench1 SET field5=1 WHERE field_search=241;
UPDATE bench1 SET field5=1 WHERE field_search=242;
UPDATE bench1 SET field5=1 WHERE field_search=243;
UPDATE bench1 SET field5=1 WHERE field_search=244;
UPDATE bench1 SET field5=1 WHERE field_search=245;
UPDATE bench1 SET field5=1 WHERE field_search=246;
UPDATE bench1 SET field5=1 WHERE field_search=247;
UPDATE bench1 SET field5=1 WHERE field_search=248;
UPDATE bench1 SET field5=1 WHERE field_search=249;
UPDATE bench1 SET field5=1 WHERE field_search=250;
UPDATE bench1 SET field5=1 WHERE field_search=251;
UPDATE bench1 SET field5=1 WHERE field_search=252;
UPDATE bench1 SET field5=1 WHERE field_search=253;
UPDATE bench1 SET field5=1 WHERE field_search=254;
UPDATE bench1 SET field5=1 WHERE field_search=255;
SELECT if((count(field_search) = 255), "YES", "NO") from drizzleslap.bench1;
if((count(field_search) = 255), "YES", "NO")
YES
drop table drizzleslap.bench1;
drop schema drizzleslap;
