DROP TABLE IF EXISTS `t1`;
DROP TABLE IF EXISTS `t2`;
set global query_cache_servers= "127.0.0.1:$MC_PORT";
set query_cache_enable= on;
CREATE TABLE `t1` (id integer NOT NULL auto_increment primary key, name varchar(20), age int);
INSERT INTO `t1` (name, age) values ("leila", 20);
INSERT INTO `t1` (name, age) values ("lockman", 2);
INSERT INTO `t1` (name, age) values ("ali", 22);
INSERT INTO `t1` (name, age) values ("Meriem", NULL);
CREATE TABLE `t2` (id int auto_increment primary key) select * from `t1` where age > 20;
select * from t1;
id	name	age
1	leila	20
2	lockman	2
3	ali	22
4	Meriem	NULL
select * from t2;
id	name	age
3	ali	22
select * from t1, t2 where t1.name = t2.name;
id	name	age	id	name	age
3	ali	22	3	ali	22
select t.table from data_dictionary.query_cached_tables t;
table
testt1
testt2
select d.schema, d.sql from data_dictionary.query_cache_entries d;
schema	sql
test	select * from t2
test	select * from t1, t2 where t1.name = t2.name
test	select * from t1
INSERT INTO `t1` (name, age) values ("Foued", 35);
select t.table from data_dictionary.query_cached_tables t;
table
testt2
select d.schema, d.sql from data_dictionary.query_cache_entries d;
schema	sql
test	select * from t2
UPDATE `t2` set age= age + 4;
select t.table from data_dictionary.query_cached_tables t;
table
select d.schema, d.sql from data_dictionary.query_cache_entries d;
schema	sql
select query_cache_flush();
query_cache_flush()
1
select * from t1;
id	name	age
1	leila	20
2	lockman	2
3	ali	22
4	Meriem	NULL
5	Foued	35
select * from t2;
id	name	age
3	ali	26
select * from t1, t2 where t1.name = t2.name;
id	name	age	id	name	age
3	ali	22	3	ali	26
select t.table from data_dictionary.query_cached_tables t;
table
testt1
testt2
select d.schema, d.sql from data_dictionary.query_cache_entries d;
schema	sql
test	select * from t2
test	select * from t1, t2 where t1.name = t2.name
test	select * from t1
delete from t1 where name= "ali";
select t.table from data_dictionary.query_cached_tables t;
table
testt2
select d.schema, d.sql from data_dictionary.query_cache_entries d;
schema	sql
test	select * from t2
select query_cache_flush();
query_cache_flush()
1
select * from t1;
id	name	age
1	leila	20
2	lockman	2
4	Meriem	NULL
5	Foued	35
select * from t2;
id	name	age
3	ali	26
select * from t1, t2 where t1.name = t2.name;
id	name	age	id	name	age
select t.table from data_dictionary.query_cached_tables t;
table
testt1
testt2
select d.schema, d.sql from data_dictionary.query_cache_entries d;
schema	sql
test	select * from t2
test	select * from t1, t2 where t1.name = t2.name
test	select * from t1
DROP TABLE `t2`;
select t.table from data_dictionary.query_cached_tables t;
table
testt1
select d.schema, d.sql from data_dictionary.query_cache_entries d;
schema	sql
test	select * from t1
