drop table if exists t1, t2;
create table t1 (a decimal, b decimal) engine = blitzdb;
insert into t1 values (1,0);
insert into t1 values (1,1);
insert into t1 values (1,2);
insert into t1 values (1,4);
insert into t1 values (1,8);
select * from t1;
a	b
1	0
1	1
1	2
1	4
1	8
select * from t1 where b <= 2;
a	b
1	0
1	1
1	2
drop table t1;
create table t2 (a decimal(65,0)) engine = blitzdb;
insert into t2 select repeat(1, 65);
insert into t2 select repeat(1, 66);
ERROR 22003: Out of range value for column 'a' at row 1
select * from t2;
a
11111111111111111111111111111111111111111111111111111111111111111
drop table t2;
create table t2 (a decimal(65,8)) engine = blitzdb;
insert into t2 select repeat(1, 57);
insert into t2 select repeat(1, 58);
ERROR 22003: Out of range value for column 'a' at row 1
delete from t2;
insert into t2 values (
-1111111111111111111111111111111111111111111111111111111111
);
ERROR 22003: Out of range value for column 'a' at row 1
insert into t2 values (
1111111111111111111111111111111111111111111111111.11111111
);
insert into t2 values (
111111111111111111111111111111111111111111111111.111111111
);
ERROR 01000: Data truncated for column 'a' at row 1
select * from t2;
a
1111111111111111111111111111111111111111111111111.11111111
drop table t2;
