drop table if exists t1, t2;
create table t1 (id int primary key, a int, b int) engine = blitzdb;
insert into t1 values (1, 1, 1), (2, 2, 2), (3, 3, 3), (4, 4, 4);
insert into t1 values (5, 5, 5), (6, 6, 6), (7, 7, 7), (8, 8, 8);
insert into t1 values (1, 0, 0);
ERROR 23000: Duplicate entry '1' for key 'PRIMARY'
insert into t1 values (2, 0, 0);
ERROR 23000: Duplicate entry '2' for key 'PRIMARY'
insert into t1 values (3, 0, 0);
ERROR 23000: Duplicate entry '3' for key 'PRIMARY'
insert into t1 values (4, 0, 0);
ERROR 23000: Duplicate entry '4' for key 'PRIMARY'
select * from t1 where id = 2;
id	a	b
2	2	2
select * from t1 where id = 4;
id	a	b
4	4	4
select * from t1 where id = 6;
id	a	b
6	6	6
delete from t1 where id = 5;
delete from t1 where id = 6;
delete from t1 where id = 7;
delete from t1 where id = 8;
select * from t1;
id	a	b
1	1	1
2	2	2
3	3	3
4	4	4
drop table t1;
create table t1 (id int primary key auto_increment, num int) engine = blitzdb;
insert into t1 (num) values (1);
insert into t1 (num) values (1);
insert into t1 (num) values (1);
insert into t1 (num) values (1);
flush table t1;
insert into t1 (num) values (1);
insert into t1 (num) values (1);
insert into t1 (num) values (1);
insert into t1 (num) values (1);
select * from t1;
id	num
1	1
2	1
3	1
4	1
5	1
6	1
7	1
8	1
drop table t1;
