drop table if exists t1, t2;
create table t1 (id int primary key, a int, b int) engine = blitzdb;
select * from t1;
id	a	b
insert into t1 values (1, 1, 1), (2, 2, 2), (3, 3, 3), (4, 4, 4);
insert into t1 values (5, 5, 5), (6, 6, 6), (7, 7, 7), (8, 8, 8);
insert into t1 values (9, 9, 9), (10, 10, 10), (11, 11, 11), (12, 12, 12);
insert into t1 values (13, 13, 13), (14, 14, 14), (15, 15, 15), (16, 16, 16);
explain select count (*) from t1;
id	select_type	table	type	possible_keys	key	key_len	ref	rows	Extra
1	SIMPLE	NULL	NULL	NULL	NULL	NULL	NULL	NULL	Select tables optimized away
insert into t1 values (2147483648, 1, 1);
ERROR 22003: Out of range value for column 'id' at row 1
insert into t1 values (1, 0, 0);
ERROR 23000: Duplicate entry '1' for key 'PRIMARY'
insert into t1 values (2, 0, 0);
ERROR 23000: Duplicate entry '2' for key 'PRIMARY'
insert into t1 values (3, 0, 0);
ERROR 23000: Duplicate entry '3' for key 'PRIMARY'
insert into t1 values (4, 0, 0);
ERROR 23000: Duplicate entry '4' for key 'PRIMARY'
select * from t1 where id = 2;
id	a	b
2	2	2
select * from t1 where id = 4;
id	a	b
4	4	4
select * from t1 where id = 6;
id	a	b
6	6	6
update t1 set a = 70 where id = 7;
update t1 set a = 80 where id = 8;
select * from t1 order by id;
id	a	b
1	1	1
2	2	2
3	3	3
4	4	4
5	5	5
6	6	6
7	70	7
8	80	8
9	9	9
10	10	10
11	11	11
12	12	12
13	13	13
14	14	14
15	15	15
16	16	16
update t1 set id = 2 where id = 1;
ERROR 23000: Duplicate entry '2' for key 'PRIMARY'
update t1 set id = 17 where id = 1;
update t1 set id = 18 where id = 2;
update t1 set id = 19 where id = 3;
update t1 set id = 20 where id = 4;
update t1 set id = 21 where id = 5;
update t1 set id = 22 where id = 6;
update t1 set id = 23 where id = 7;
update t1 set id = 20 where id = 8;
ERROR 23000: Duplicate entry '20' for key 'PRIMARY'
select * from t1 order by id;
id	a	b
8	80	8
9	9	9
10	10	10
11	11	11
12	12	12
13	13	13
14	14	14
15	15	15
16	16	16
17	1	1
18	2	2
19	3	3
20	4	4
21	5	5
22	6	6
23	70	7
select count (*) from t1;
count (*)
16
delete from t1 where id = 8;
select count (*) from t1;
count (*)
15
delete from t1 where id = 9;
select count (*) from t1;
count (*)
14
delete from t1 where id = 18;
select count (*) from t1;
count (*)
13
delete from t1 where id = 19;
select count (*) from t1;
count (*)
12
select count (id) from t1;
count (id)
12
select count (a) from t1;
count (a)
12
select count (b) from t1;
count (b)
12
select * from t1 order by id;
id	a	b
10	10	10
11	11	11
12	12	12
13	13	13
14	14	14
15	15	15
16	16	16
17	1	1
20	4	4
21	5	5
22	6	6
23	70	7
delete from t1 where id > 10 and id < 14;
select * from t1 order by id;
id	a	b
10	10	10
14	14	14
15	15	15
16	16	16
17	1	1
20	4	4
21	5	5
22	6	6
23	70	7
select count (*) from t1;
count (*)
9
delete from t1 where id >= 20 and id <= 23;
select * from t1 order by id;
id	a	b
10	10	10
14	14	14
15	15	15
16	16	16
17	1	1
select count (*) from t1;
count (*)
5
delete from t1 where a > 20;
select count(*) from t1;
count(*)
5
drop table t1;
create table t1 (id bigint primary key, a int) engine = blitzdb;
insert into t1 values (2147483647, 1);
insert into t1 values (1.8e+18, 2);
insert into t1 values (1.8e+19, 3);
ERROR 22003: Out of range value for column 'id' at row 1
insert into t1 values (1,1), (2,2), (3,3), (4,4);
update t1 set id = 4 where id = 1;
ERROR 23000: Duplicate entry '4' for key 'PRIMARY'
update t1 set id = 10 where id = 1;
update t1 set id = 20 where id = 2;
update t1 set id = 30 where id = 3;
update t1 set id = 40 where id = 4;
select count(*) from t1 where id < 10;
count(*)
0
explain select id from t1 where id in (10, 20, 30, 40);
id	select_type	table	type	possible_keys	key	key_len	ref	rows	Extra
1	SIMPLE	t1	range	PRIMARY	PRIMARY	8	NULL	4	Using where; Using index
select id from t1 where id in (10, 20, 30, 40);
id
10
20
30
40
select * from t1;
id	a
2147483647	1
1800000000000000000	2
10	1
20	2
30	3
40	4
delete from t1 where id = 10;
delete from t1 where id = 20;
delete from t1 where id in (30, 40);
select * from t1;
id	a
2147483647	1
1800000000000000000	2
drop table t1;
create table t1 (id int primary key auto_increment, num int) engine = blitzdb;
insert into t1 (num) values (1);
select * from t1;
id	num
1	1
insert into t1 (num) values (1);
insert into t1 (num) values (1);
insert into t1 (num) values (1);
select count(*) from t1;
count(*)
4
flush table t1;
select count(*) from t1;
count(*)
4
insert into t1 (num) values (1);
insert into t1 (num) values (1);
insert into t1 (num) values (1);
insert into t1 (num) values (1);
select count(*) from t1;
count(*)
8
select count(num) from t1;
count(num)
8
select * from t1;
id	num
1	1
2	1
3	1
4	1
5	1
6	1
7	1
8	1
drop table t1;
create table t1 (id int primary key auto_increment) engine = blitzdb;
insert into t1 values (1), (2), (3), (4);
insert into t1 values (8), (9), (10), (11);
insert into t1 values (5), (7);
select * from t1;
id
1
2
3
4
5
7
8
9
10
11
insert into t1 values (), (), ();
select * from t1;
id
1
2
3
4
5
7
8
9
10
11
12
13
14
drop table t1;
create table t1 (id int primary key auto_increment) engine = blitzdb;
insert into t1 values ();
insert into t1 values ();
insert into t1 values ();
insert into t1 values ();
select count(*) from t1;
count(*)
4
delete from t1 where id = 1;
delete from t1 where id = 2;
select count(*) from t1;
count(*)
2
insert into t1 values ();
insert into t1 values ();
select count(*) from t1;
count(*)
4
drop table t1;
create table t1 (id double primary key, a int) engine = blitzdb;
insert into t1 values (1.1, 1);
insert into t1 values (1.11, 2);
insert into t1 values (1.111, 3);
insert into t1 values (1.1111, 4);
insert into t1 values (2.2, 5);
insert into t1 values (2.22, 6);
insert into t1 values (2.222, 7);
insert into t1 values (2.2222, 8);
select * from t1;
id	a
1.1	1
1.11	2
1.111	3
1.1111	4
2.2	5
2.22	6
2.222	7
2.2222	8
update t1 set id = 1.11 where id = 1.1;
ERROR 23000: Duplicate entry '1.11' for key 'PRIMARY'
update t1 set id = 2.22 where id = 2.2;
ERROR 23000: Duplicate entry '2.22' for key 'PRIMARY'
update t1 set id = 3.3 where id = 1.1;
update t1 set id = 3.33 where id = 1.11;
update t1 set id = 3.333 where id = 1.111;
update t1 set id = 3.3333 where id = 1.1111;
select * from t1 order by id;
id	a
2.2	5
2.22	6
2.222	7
2.2222	8
3.3	1
3.33	2
3.333	3
3.3333	4
update t1 set id = 2.2 where id = 3.3;
ERROR 23000: Duplicate entry '2.2' for key 'PRIMARY'
delete from t1 where id = 3.3;
delete from t1 where id = 3.33;
select * from t1 order by id;
id	a
2.2	5
2.22	6
2.222	7
2.2222	8
3.333	3
3.3333	4
drop table t1;
create table t1 (id varchar(64) primary key, country varchar(64)) engine = blitzdb;
insert into t1 values ('amsterdam', 'netherlands');
insert into t1 values ('budapest', 'hungary');
insert into t1 values ('copenhagen', 'denmark');
insert into t1 values ('dublin', 'ireland');
insert into t1 values ('edinburgh', 'scotland');
insert into t1 values ('fukuoka', 'japan');
insert into t1 values ('geneva', 'switzerland');
select * from t1 order by id;
id	country
amsterdam	netherlands
budapest	hungary
copenhagen	denmark
dublin	ireland
edinburgh	scotland
fukuoka	japan
geneva	switzerland
select country from t1 where id = 'dublin';
country
ireland
select country from t1 where id = 'geneva';
country
switzerland
select country from t1 where id = 'amsterdam';
country
netherlands
select country from t1 where id = 'non existent key';
country
select country from t1 where id = 'edinburgh';
country
scotland
select country from t1 where id = 'copenhagen';
country
denmark
select country from t1 where id = 'fukuoka';
country
japan
select country from t1 where id = 'budapest';
country
hungary
select count (id) from t1;
count (id)
7
update t1 set id = 'dublin' where id = 'geneva';
ERROR 23000: Duplicate entry 'dublin' for key 'PRIMARY'
update t1 set id = 'berlin', country = 'germany' where id = 'budapest';
update t1 set id = 'london', country = 'england' where id = 'copenhagen';
update t1 set id = 'paris', country = 'france' where id = 'dublin';
explain select * from t1 where id = 'berlin';
id	select_type	table	type	possible_keys	key	key_len	ref	rows	Extra
1	SIMPLE	t1	const	PRIMARY	PRIMARY	258	const	1	
select * from t1 where id = 'berlin';
id	country
berlin	germany
select * from t1 where id = 'london';
id	country
london	england
select * from t1 where id = 'paris';
id	country
paris	france
delete from t1 where id = 'geneva';
delete from t1 where id = 'fukuoka';
select count (id) from t1;
count (id)
5
select count (*) from t1;
count (*)
5
select * from t1 order by id;
id	country
amsterdam	netherlands
berlin	germany
edinburgh	scotland
london	england
paris	france
delete from t1 where id < 'london';
select count (*) from t1;
count (*)
2
select * from t1 order by id;
id	country
london	england
paris	france
drop table t1;
create table t1 (a varchar(10) primary key, b int) engine = blitzdb;
insert into t1 values ('aaa', 1), ('bbb', 2), ('ccc', 3), ('ddd', 4);
insert into t1 values ('eee', 5), ('fff', 6), ('ggg', 7), ('hhh', 8);
select * from t1 where a = 'aaa';
a	b
aaa	1
select * from t1 where a = 'bbb';
a	b
bbb	2
select * from t1 where a = 'ccc';
a	b
ccc	3
select * from t1 where a = 'ddd';
a	b
ddd	4
select * from t1;
a	b
aaa	1
bbb	2
ccc	3
ddd	4
eee	5
fff	6
ggg	7
hhh	8
delete from t1 where a = 'ggg';
delete from t1 where a = 'hhh';
select * from t1;
a	b
aaa	1
bbb	2
ccc	3
ddd	4
eee	5
fff	6
update t1 set a = 'ddd' where a = 'aaa';
ERROR 23000: Duplicate entry 'ddd' for key 'PRIMARY'
update t1 set a = 'ccc' where a = 'bbb';
ERROR 23000: Duplicate entry 'ccc' for key 'PRIMARY'
update t1 set a = 'zzz' where a = 'fff';
select count(*) from t1 where a = 'fff';
count(*)
0
select * from t1 where a = 'zzz';
a	b
zzz	6
select * from t1;
a	b
aaa	1
bbb	2
ccc	3
ddd	4
eee	5
zzz	6
drop table t1;
create table t1 (a date primary key, b int, c varchar(32)) engine = blitzdb;
insert into t1 values ('1984-09-22', 22, 'twenty two');
insert into t1 values ('1984-09-23', 23, 'twenty three');
insert into t1 values ('1984-09-24', 24, 'twenty four');
insert into t1 values ('1984-09-25', 23, 'twenty five');
select * from t1;
a	b	c
1984-09-22	22	twenty two
1984-09-23	23	twenty three
1984-09-24	24	twenty four
1984-09-25	23	twenty five
explain select * from t1 where a = '1984-09-22';
id	select_type	table	type	possible_keys	key	key_len	ref	rows	Extra
1	SIMPLE	t1	const	PRIMARY	PRIMARY	4	const	1	
select * from t1 where a = '1984-09-22';
a	b	c
1984-09-22	22	twenty two
select * from t1 where a = '1984-09-23';
a	b	c
1984-09-23	23	twenty three
select * from t1 where a = '1984-09-24';
a	b	c
1984-09-24	24	twenty four
select * from t1 where a = '1984-09-25';
a	b	c
1984-09-25	23	twenty five
update t1 set a = '1984-09-22' where a = '1984-09-25';
ERROR 23000: Duplicate entry '1984-09-22' for key 'PRIMARY'
update t1 set a = '19840922' where a = '1984-09-25';
ERROR 23000: Duplicate entry '1984-09-22' for key 'PRIMARY'
update t1 set a = '2010-03-10' where a = '1984-09-22';
update t1 set a = '2010-03-11', b = 777, c = 'triple seven' where a = '1984-09-23';
select * from t1 order by a;
a	b	c
1984-09-24	24	twenty four
1984-09-25	23	twenty five
2010-03-10	22	twenty two
2010-03-11	777	triple seven
drop table t1;
create table t1 (a int primary key) engine = blitzdb;
insert into t1 values (1), (2), (3), (4), (5), (6);
explain select * from t1 order by a desc;
id	select_type	table	type	possible_keys	key	key_len	ref	rows	Extra
1	SIMPLE	t1	index	NULL	PRIMARY	4	NULL	6	Using index
select * from t1;
a
1
2
3
4
5
6
explain select * from t1 order by a desc;
id	select_type	table	type	possible_keys	key	key_len	ref	rows	Extra
1	SIMPLE	t1	index	NULL	PRIMARY	4	NULL	6	Using index
select * from t1 order by a desc;
a
6
5
4
3
2
1
delete from t1;
insert into t1 values (6), (1), (5), (3), (2), (4);
explain select * from t1;
id	select_type	table	type	possible_keys	key	key_len	ref	rows	Extra
1	SIMPLE	t1	index	NULL	PRIMARY	4	NULL	6	Using index
select * from t1;
a
1
2
3
4
5
6
explain select * from t1 order by a desc;
id	select_type	table	type	possible_keys	key	key_len	ref	rows	Extra
1	SIMPLE	t1	index	NULL	PRIMARY	4	NULL	6	Using index
select * from t1 order by a desc;
a
6
5
4
3
2
1
explain select max(a) from t1;
id	select_type	table	type	possible_keys	key	key_len	ref	rows	Extra
1	SIMPLE	NULL	NULL	NULL	NULL	NULL	NULL	NULL	Select tables optimized away
select max(a) from t1;
max(a)
6
explain select min(a) from t1;
id	select_type	table	type	possible_keys	key	key_len	ref	rows	Extra
1	SIMPLE	NULL	NULL	NULL	NULL	NULL	NULL	NULL	Select tables optimized away
select min(a) from t1;
min(a)
1
explain select sum(a) from t1;
id	select_type	table	type	possible_keys	key	key_len	ref	rows	Extra
1	SIMPLE	t1	index	NULL	PRIMARY	4	NULL	6	Using index
select sum(a) from t1;
sum(a)
21
drop table t1;
create table t1 (a bigint primary key) engine = blitzdb;
insert into t1 values (10), (20), (30), (40), (50), (60);
explain select * from t1;
id	select_type	table	type	possible_keys	key	key_len	ref	rows	Extra
1	SIMPLE	t1	index	NULL	PRIMARY	8	NULL	6	Using index
select * from t1;
a
10
20
30
40
50
60
select * from t1 order by a desc;
a
60
50
40
30
20
10
delete from t1;
insert into t1 values (60), (10), (50), (30), (20), (40);
select * from t1;
a
10
20
30
40
50
60
select * from t1 order by a desc;
a
60
50
40
30
20
10
drop table t1;
create table t1 (a varchar(10) primary key) engine = blitzdb;
insert into t1 values ('a'), ('b'), ('c'), ('d'), ('e');
select * from t1;
a
a
b
c
d
e
explain select * from t1 order by a desc;
id	select_type	table	type	possible_keys	key	key_len	ref	rows	Extra
1	SIMPLE	t1	index	NULL	PRIMARY	42	NULL	5	Using index
select * from t1 order by a desc;
a
e
d
c
b
a
delete from t1;
insert into t1 values ('c'), ('a'), ('e'), ('b'), ('d');
select * from t1;
a
a
b
c
d
e
delete from t1;
insert into t1 values ('う'), ('お'), ('い'), ('あ'), ('え');
insert into t1 values ('こ'), ('け'), ('か'), ('く'), ('き');
explain select * from t1;
id	select_type	table	type	possible_keys	key	key_len	ref	rows	Extra
1	SIMPLE	t1	index	NULL	PRIMARY	42	NULL	10	Using index
select * from t1;
a
あ
い
う
え
お
か
き
く
け
こ
explain select * from t1 order by a desc;
id	select_type	table	type	possible_keys	key	key_len	ref	rows	Extra
1	SIMPLE	t1	index	NULL	PRIMARY	42	NULL	10	Using index
select * from t1 order by a desc;
a
こ
け
く
き
か
お
え
う
い
あ
drop table t1;
create table t1 (a varchar(255) primary key) engine = blitzdb;
insert into t1 values ('a'), ('b'), ('c'), ('d'), ('e');
explain select * from t1;
id	select_type	table	type	possible_keys	key	key_len	ref	rows	Extra
1	SIMPLE	t1	index	NULL	PRIMARY	1022	NULL	5	Using index
select * from t1;
a
a
b
c
d
e
select * from t1 order by a desc;
a
e
d
c
b
a
delete from t1;
insert into t1 values ('c'), ('a'), ('e'), ('b'), ('d');
select * from t1;
a
a
b
c
d
e
delete from t1;
drop table t1;
create table t1 (a int, unique index(a)) engine = blitzdb;
insert into t1 values (1), (2);
insert into t1 values (1);
ERROR 23000: Duplicate entry '1' for key 'a'
insert into t1 values (2);
ERROR 23000: Duplicate entry '2' for key 'a'
insert into t1 values (NULL);
insert into t1 values (3);
insert into t1 values (4);
select * from t1;
a
NULL
1
2
3
4
select * from t1 where a = 1;
a
1
select * from t1 where a = 2;
a
2
select * from t1 where a = 3;
a
3
select * from t1 where a = 4;
a
4
select * from t1 where a is NULL;
a
NULL
drop table t1;
create table t1 (a varchar(32), unique index(a)) engine = blitzdb;
insert into t1 values ('a'), ('b'), ('c');
insert into t1 values ('a');
ERROR 23000: Duplicate entry 'a' for key 'a'
insert into t1 values ('b');
ERROR 23000: Duplicate entry 'b' for key 'a'
insert into t1 values ('c');
ERROR 23000: Duplicate entry 'c' for key 'a'
insert into t1 values ('f'), ('e'), ('d');
select * from t1;
a
a
b
c
d
e
f
select count(*) from t1;
count(*)
6
explain select * from t1 where a = 'a';
id	select_type	table	type	possible_keys	key	key_len	ref	rows	Extra
1	SIMPLE	t1	const	a	a	131	const	1	Using index
select * from t1 where a = 'a';
a
a
select * from t1 where a = 'b';
a
b
select * from t1 where a = 'c';
a
c
select * from t1 where a = 'd';
a
d
select * from t1 where a = 'e';
a
e
select * from t1 where a = 'f';
a
f
delete from t1 where a = 'a';
delete from t1 where a = 'b';
select count(*) from t1;
count(*)
4
select * from t1;
a
c
d
e
f
delete from t1 where a = 'c';
delete from t1 where a = 'd';
delete from t1 where a = 'e';
delete from t1 where a = 'f';
select count(*) from t1;
count(*)
0
select * from t1;
a
drop table t1;
create table t1 (a int, index(a)) engine = blitzdb;
insert into t1 values (1), (2), (3), (4);
insert into t1 values (1), (2), (3), (4);
select * from t1;
a
1
1
2
2
3
3
4
4
insert into t1 values (NULL), (NULL);
insert into t1 values (NULL), (NULL);
select * from t1;
a
NULL
NULL
NULL
NULL
1
1
2
2
3
3
4
4
select count(*) from t1 where a is NULL;
count(*)
4
select * from t1 where a is NULL;
a
NULL
NULL
NULL
NULL
select * from t1 where a is not NULL;
a
1
1
2
2
3
3
4
4
explain select * from t1 where a = 1;
id	select_type	table	type	possible_keys	key	key_len	ref	rows	Extra
1	SIMPLE	t1	ref	a	a	5	const	4	Using where; Using index
select * from t1 where a = 1;
a
1
1
select * from t1 where a = 2;
a
2
2
select * from t1 where a = 3;
a
3
3
select * from t1 where a = 4;
a
4
4
delete from t1 where a = 3;
select * from t1 where a = 3;
a
delete from t1 where a = 1;
select * from t1 where a = 1;
a
select * from t1;
a
NULL
NULL
NULL
NULL
2
2
4
4
delete from t1 where a is NULL;
select * from t1 where a is NULL;
a
delete from t1 where a = 2;
select * from t1 where a = 2;
a
delete from t1 where a = 4;
select * from t1 where a = 4;
a
select count(*) from t1;
count(*)
0
drop table t1;
create table t1 (a int, b int, unique index(a)) engine = blitzdb;
insert into t1 values (NULL, 1), (NULL, 2), (NULL, 3), (NULL, 4);
select * from t1;
a	b
NULL	1
NULL	2
NULL	3
NULL	4
select * from t1 where a is NULL;
a	b
NULL	1
NULL	2
NULL	3
NULL	4
insert into t1 values (1, 5), (2, 6);
insert into t1 values (1, 7), (1, 8);
ERROR 23000: Duplicate entry '1' for key 'a'
select * from t1 where a is not NULL;
a	b
1	5
2	6
delete from t1 where a is NULL;
select * from t1;
a	b
1	5
2	6
select count(*) from t1;
count(*)
2
drop table t1;
create table t1 (
id int primary key,
lastname varchar(64),
description varchar(255), 
price int,
INDEX(price)
) engine = blitzdb;
insert into t1 values (1, "Schwartz", "Flight", 1500);
insert into t1 values (2, "Hayes", "Computer Equipment", 400);
insert into t1 values (3, "Lawrence", "Text Books", 220);
insert into t1 values (4, "Smith", "Weaponry", 45500);
insert into t1 values (5, "Yamada", "Dinner", 120);
insert into t1 values (6, "Smith", "Lunch", 30);
insert into t1 values (7, "Hayes", "Lunch", 30);
insert into t1 values (8, "Kinoshita", "Computer Equipment", 3740);
select * from t1;
id	lastname	description	price
1	Schwartz	Flight	1500
2	Hayes	Computer Equipment	400
3	Lawrence	Text Books	220
4	Smith	Weaponry	45500
5	Yamada	Dinner	120
6	Smith	Lunch	30
7	Hayes	Lunch	30
8	Kinoshita	Computer Equipment	3740
select sum(price) from t1;
sum(price)
51540
select lastname, sum(price) from t1 group by lastname;
lastname	sum(price)
Hayes	430
Kinoshita	3740
Lawrence	220
Schwartz	1500
Smith	45530
Yamada	120
drop table t1;
create table t1 (a int, b int, c int, d int, primary key(a, b)) engine = blitzdb;
ERROR HY000: Can't create table 'test.t1' (errno: 138)
create table t1 (a int, b int, c int, d int, primary key(a, b, c)) engine = blitzdb;
ERROR HY000: Can't create table 'test.t1' (errno: 138)
create table t1 (a int, b int, c int, d int, index(a, b)) engine = blitzdb;
ERROR HY000: Can't create table 'test.t1' (errno: 138)
create table t1 (a int, b int, c int, d int, index(a, b, c)) engine = blitzdb;
ERROR HY000: Can't create table 'test.t1' (errno: 138)
create table t1 (a int, b int, c int, d int, unique(a, b)) engine = blitzdb;
ERROR HY000: Can't create table 'test.t1' (errno: 138)
create table t1 (a int, b int, c int, d int, unique(a, b, c)) engine = blitzdb;
ERROR HY000: Can't create table 'test.t1' (errno: 138)
create table `t1` (
`col_varchar_10_key` varchar(10),
`col_int_key` int,
`col_varchar_1024_key` varchar(1024),
pk integer auto_increment,
`col_varchar_10` varchar(10),
`col_int` int,
`col_varchar_1024` varchar(1024),
key (`col_varchar_10_key`),
key (`col_int_key`),
key (`col_varchar_1024_key`),
primary key (pk)
) engine = blitzdb;
Warnings:
Warning	1071	Specified key was too long; max key length is 1024 bytes
insert /*! IGNORE */ into t1 values ('x', NULL, 'keyone', NULL, 'could', 1322188800, 'I\'m');
insert /*! IGNORE */ into t1 values ('y', NULL, 'keytwo', NULL, 'could', 1322188800, 'I\'m');
insert /*! IGNORE */ into t1 values ('z', NULL, 'keythree', NULL, 'could', 1322188800, 'I\'m');
select * from t1;
col_varchar_10_key	col_int_key	col_varchar_1024_key	pk	col_varchar_10	col_int	col_varchar_1024
x	NULL	keyone	1	could	1322188800	I'm
y	NULL	keytwo	2	could	1322188800	I'm
z	NULL	keythree	3	could	1322188800	I'm
drop table t1;
