SELECT VARIABLE_NAME,VARIABLE_VALUE FROM DATA_DICTIONARY.GLOBAL_VARIABLES WHERE VARIABLE_NAME LIKE "hello%";
VARIABLE_NAME	VARIABLE_VALUE
hello_events1_before_update_position	1
hello_events1_before_write_position	1
hello_events1_enable	ON
hello_events1_post_drop_position	-1
hello_events1_watch_databases	events
hello_events1_watch_tables	t2
select IF(@BEFORE_INSERT_RECORD, "YES", "NO");
IF(@BEFORE_INSERT_RECORD, "YES", "NO")
NO
select IF(@AFTER_INSERT_RECORD, "YES", "NO");
IF(@AFTER_INSERT_RECORD, "YES", "NO")
NO
select IF(@BEFORE_UPDATE_RECORD, "YES", "NO");
IF(@BEFORE_UPDATE_RECORD, "YES", "NO")
NO
select IF(@AFTER_UPDATE_RECORD, "YES", "NO");
IF(@AFTER_UPDATE_RECORD, "YES", "NO")
NO
select IF(@BEFORE_DELETE_RECORD, "YES", "NO");
IF(@BEFORE_DELETE_RECORD, "YES", "NO")
NO
select IF(@AFTER_DELETE_RECORD, "YES", "NO");
IF(@AFTER_DELETE_RECORD, "YES", "NO")
NO
CREATE TABLE t1 (a SERIAL);
select IF(@BEFORE_INSERT_RECORD, "YES", "NO");
IF(@BEFORE_INSERT_RECORD, "YES", "NO")
NO
select IF(@AFTER_INSERT_RECORD, "YES", "NO");
IF(@AFTER_INSERT_RECORD, "YES", "NO")
NO
select IF(@BEFORE_UPDATE_RECORD, "YES", "NO");
IF(@BEFORE_UPDATE_RECORD, "YES", "NO")
NO
select IF(@AFTER_UPDATE_RECORD, "YES", "NO");
IF(@AFTER_UPDATE_RECORD, "YES", "NO")
NO
select IF(@BEFORE_DELETE_RECORD, "YES", "NO");
IF(@BEFORE_DELETE_RECORD, "YES", "NO")
NO
select IF(@AFTER_DELETE_RECORD, "YES", "NO");
IF(@AFTER_DELETE_RECORD, "YES", "NO")
NO
INSERT INTO t1 VALUES ();
select IF(@BEFORE_INSERT_RECORD, "YES", "NO");
IF(@BEFORE_INSERT_RECORD, "YES", "NO")
NO
select IF(@AFTER_INSERT_RECORD, "YES", "NO");
IF(@AFTER_INSERT_RECORD, "YES", "NO")
NO
select IF(@BEFORE_UPDATE_RECORD, "YES", "NO");
IF(@BEFORE_UPDATE_RECORD, "YES", "NO")
NO
select IF(@AFTER_UPDATE_RECORD, "YES", "NO");
IF(@AFTER_UPDATE_RECORD, "YES", "NO")
NO
select IF(@BEFORE_DELETE_RECORD, "YES", "NO");
IF(@BEFORE_DELETE_RECORD, "YES", "NO")
NO
select IF(@AFTER_DELETE_RECORD, "YES", "NO");
IF(@AFTER_DELETE_RECORD, "YES", "NO")
NO
INSERT INTO t1 VALUES ();
INSERT INTO t1 VALUES ();
select IF(@BEFORE_INSERT_RECORD, "YES", "NO");
IF(@BEFORE_INSERT_RECORD, "YES", "NO")
NO
select IF(@AFTER_INSERT_RECORD, "YES", "NO");
IF(@AFTER_INSERT_RECORD, "YES", "NO")
NO
select IF(@BEFORE_UPDATE_RECORD, "YES", "NO");
IF(@BEFORE_UPDATE_RECORD, "YES", "NO")
NO
select IF(@AFTER_UPDATE_RECORD, "YES", "NO");
IF(@AFTER_UPDATE_RECORD, "YES", "NO")
NO
select IF(@BEFORE_DELETE_RECORD, "YES", "NO");
IF(@BEFORE_DELETE_RECORD, "YES", "NO")
NO
select IF(@AFTER_DELETE_RECORD, "YES", "NO");
IF(@AFTER_DELETE_RECORD, "YES", "NO")
NO
UPDATE t1  SET a= a+10;
select IF(@BEFORE_INSERT_RECORD, "YES", "NO");
IF(@BEFORE_INSERT_RECORD, "YES", "NO")
NO
select IF(@AFTER_INSERT_RECORD, "YES", "NO");
IF(@AFTER_INSERT_RECORD, "YES", "NO")
NO
select IF(@BEFORE_UPDATE_RECORD, "YES", "NO");
IF(@BEFORE_UPDATE_RECORD, "YES", "NO")
NO
select IF(@AFTER_UPDATE_RECORD, "YES", "NO");
IF(@AFTER_UPDATE_RECORD, "YES", "NO")
NO
select IF(@BEFORE_DELETE_RECORD, "YES", "NO");
IF(@BEFORE_DELETE_RECORD, "YES", "NO")
NO
select IF(@AFTER_DELETE_RECORD, "YES", "NO");
IF(@AFTER_DELETE_RECORD, "YES", "NO")
NO
DROP TABLE t1;
