create table t1 (a int not null auto_increment primary key);
insert into t1 values (NULL);
insert into t1 values (NULL);
insert into t1 values (NULL);
insert into t1 values (NULL);
insert into t1 values (NULL);
insert into t1 values (NULL);
insert into t1 values (-1);
select last_insert_id();
last_insert_id()
6
delete from t1 where a in (2,3,4);
insert into t1 values (NULL);
select * from t1;
a
-1
1
5
6
7
drop table t1;
