SHOW CREATE TABLE DATA_DICTIONARY.haildb_STATUS;
Table	Create Table
HAILDB_STATUS	CREATE TABLE `HAILDB_STATUS` (
  `NAME` VARCHAR(256) NOT NULL,
  `VALUE` BIGINT DEFAULT NULL
) ENGINE=FunctionEngine COLLATE = utf8_general_ci
SELECT COUNT(NAME) FROM DATA_DICTIONARY.haildb_STATUS;
COUNT(NAME)
41
SELECT NAME FROM DATA_DICTIONARY.haildb_STATUS;
NAME
read_req_pending
write_req_pending
fsync_req_pending
write_req_done
read_req_done
fsync_req_done
bytes_total_written
bytes_total_read
buffer_pool_current_size
buffer_pool_data_pages
buffer_pool_dirty_pages
buffer_pool_misc_pages
buffer_pool_free_pages
buffer_pool_read_reqs
buffer_pool_reads
buffer_pool_waited_for_free
buffer_pool_pages_flushed
buffer_pool_write_reqs
buffer_pool_total_pages
buffer_pool_pages_read
buffer_pool_pages_written
double_write_pages_written
double_write_invoked
log_buffer_slot_waits
log_write_reqs
log_write_flush_count
log_bytes_written
log_fsync_req_done
log_write_req_pending
log_fsync_req_pending
lock_row_waits
lock_row_waiting
lock_total_wait_time_in_secs
lock_wait_time_avg_in_secs
lock_max_wait_time_in_secs
row_total_read
row_total_inserted
row_total_updated
row_total_deleted
page_size
have_atomic_builtins
SELECT * FROM DATA_DICTIONARY.haildb_STATUS WHERE NAME="page_size";
NAME	VALUE
page_size	16384
SELECT (@fsync_count:= VALUE) AS fsyncs FROM DATA_DICTIONARY.haildb_STATUS WHERE NAME="fsync_req_done";
fsyncs
#
create table t1 (a int primary key);
SELECT (@fsync_count < @fsync_count:= VALUE) AS fsyncs FROM DATA_DICTIONARY.haildb_STATUS WHERE NAME="fsync_req_done";
fsyncs
1
insert into t1 values (1);
SELECT (@fsync_count < @fsync_count:= VALUE) AS fsyncs FROM DATA_DICTIONARY.haildb_STATUS WHERE NAME="fsync_req_done";
fsyncs
1
insert into t1 values (5),(2),(3),(4);
SELECT (@fsync_count < @fsync_count:= VALUE) AS fsyncs FROM DATA_DICTIONARY.haildb_STATUS WHERE NAME="fsync_req_done";
fsyncs
1
delete from t1;
SELECT (@fsync_count < @fsync_count:= VALUE) AS fsyncs FROM DATA_DICTIONARY.haildb_STATUS WHERE NAME="fsync_req_done";
fsyncs
1
begin;
insert into t1 values (1);
insert into t1 values (2);
insert into t1 values (3);
insert into t1 values (4);
commit;
SELECT (@fsync_count < @fsync_count:= VALUE) AS fsyncs FROM DATA_DICTIONARY.haildb_STATUS WHERE NAME="fsync_req_done";
fsyncs
1
DROP TABLE t1;
SELECT (@fsync_count < (@fsync_count:= VALUE)) AS fsyncs FROM DATA_DICTIONARY.haildb_STATUS WHERE NAME="fsync_req_done";
fsyncs
1
