drop table if exists t1;
create table t1 (t datetime, pk int auto_increment primary key);
insert into t1 (t) values (101);
insert into t1 (t) values (691231);
insert into t1 (t) values (700101);
insert into t1 (t) values (991231);
insert into t1 (t) values (10000101);
insert into t1 (t) values (99991231);
insert into t1 (t) values (101000000);
insert into t1 (t) values (691231000000);
insert into t1 (t) values (700101000000);
insert into t1 (t) values (991231235959);
insert into t1 (t) values (10000101000000);
insert into t1 (t) values (99991231235959);
insert into t1 (t) values (20030100000000);
ERROR HY000: Received an invalid datetime value '20030100000000'.
insert into t1 (t) values (20030000000000);
ERROR HY000: Received an invalid datetime value '20030000000000'.
select t from t1;
t
2000-01-01 00:00:00
2069-12-31 00:00:00
1970-01-01 00:00:00
1999-12-31 00:00:00
1000-01-01 00:00:00
9999-12-31 00:00:00
2000-01-01 00:00:00
2069-12-31 00:00:00
1970-01-01 00:00:00
1999-12-31 23:59:59
1000-01-01 00:00:00
9999-12-31 23:59:59
delete from t1 where t > 0;
ERROR HY000: Received an invalid datetime value '0'.
delete from t1 where t > "0001-01-01 00:00:00";
alter table t1 engine="default";
check table t1;
Table	Op	Msg_type	Msg_text
test.t1	check	status	OK
delete from t1;
insert into t1 (t) values("000101");
insert into t1 (t) values("691231");
insert into t1 (t) values("700101");
insert into t1 (t) values("991231");
insert into t1 (t) values("00000101");
ERROR HY000: Received an invalid datetime value '00000101'.
insert into t1 (t) values("00010101");
insert into t1 (t) values("99991231");
insert into t1 (t) values("00101000000");
ERROR HY000: Received an invalid datetime value '00101000000'.
insert into t1 (t) values("691231000000");
ERROR HY000: Received an invalid datetime value '691231000000'.
insert into t1 (t) values("700101000000");
ERROR HY000: Received an invalid datetime value '700101000000'.
insert into t1 (t) values("991231235959");
ERROR HY000: Received an invalid datetime value '991231235959'.
insert into t1 (t) values("10000101000000");
insert into t1 (t) values("99991231235959");
insert into t1 (t) values("20030100000000");
ERROR HY000: Received an invalid datetime value '20030100000000'.
insert into t1 (t) values("20030000000000");
ERROR HY000: Received an invalid datetime value '20030000000000'.
insert into t1 (t) values ("2003-003-03");
ERROR HY000: Received an invalid datetime value '2003-003-03'.
insert into t1 (t) values ("20030102T131415");
ERROR HY000: Received an invalid datetime value '20030102T131415'.
insert into t1 (t) values ("2001-01-01T01:01:01");
insert into t1 (t) values ("2001-1-1T1:01:01");
ERROR HY000: Received an invalid datetime value '2001-1-1T1:01:01'.
select t from t1;
t
2000-01-01 00:00:00
2069-12-31 00:00:00
1970-01-01 00:00:00
1999-12-31 00:00:00
0001-01-01 00:00:00
9999-12-31 00:00:00
1000-01-01 00:00:00
9999-12-31 23:59:59
2001-01-01 01:01:01
truncate table t1;
insert into t1 (t) values("2003-0303 12:13:14");
ERROR HY000: Received an invalid datetime value '2003-0303 12:13:14'.
select t from t1;
t
drop table t1;
CREATE TABLE t1 (a datetime not null primary key);
insert into t1 values ("2009-02-11 00:00:00");
select * from t1 where a is null;
a
drop table t1;
create table t1 (id int primary key, dt datetime);
insert into t1 values (1,"2001-08-14 00:00:00"),(2,"2001-08-15 00:00:00"),(3,"2001-08-16 00:00:00"),(4,"2003-09-15 01:20:30");
select * from t1 where dt='2001-08-14 00:00:00' and dt =  if(id=1,'2001-08-14 00:00:00','1999-08-15');
id	dt
1	2001-08-14 00:00:00
create index dt on t1 (dt);
select * from t1 where dt > 20021020;
id	dt
4	2003-09-15 01:20:30
select * from t1 ignore index (dt) where dt > 20021020;
id	dt
4	2003-09-15 01:20:30
drop table t1;
CREATE TEMPORARY TABLE `t1` (
`date` datetime,
`numfacture` int NOT NULL default '0',
`expedition` datetime,
PRIMARY KEY  (`numfacture`),
KEY `date` (`date`),
KEY `expedition` (`expedition`)
) ENGINE=MyISAM;
INSERT INTO t1 (expedition) VALUES ('0001-01-01 00:00:00');
SELECT * FROM t1 WHERE expedition='0001-01-01 00:00:00';
date	numfacture	expedition
NULL	0	0001-01-01 00:00:00
INSERT INTO t1 (numfacture,expedition) VALUES ('1212','0001-01-01 00:00:00');
SELECT * FROM t1 WHERE expedition='0001-01-01 00:00:00';
date	numfacture	expedition
NULL	0	0001-01-01 00:00:00
NULL	1212	0001-01-01 00:00:00
EXPLAIN SELECT * FROM t1 WHERE expedition='0001-01-01 00:00:00';
id	select_type	table	type	possible_keys	key	key_len	ref	rows	Extra
1	SIMPLE	t1	ref	expedition	expedition	9	const	#	Using where
drop table t1;
create table t1 (a datetime not null, b datetime not null, pk int auto_increment primary key);
insert into t1 (a,b) values (now(), now());
insert into t1 (a,b) values (now(), now());
select a,b from t1 where a is null or b is null;
a	b
drop table t1;
create table t1 (t datetime primary key);
insert into t1 values (20030102030460),(20030102036301),(20030102240401),
(20030132030401),(20031302030401),(100001202030401);
ERROR HY000: Received an invalid datetime value '20030102036301'.
select * from t1;
t
delete from t1;
insert into t1 values
("2003-01-02 03:04:60"),("2003-01-02 03:63:01"),("2003-01-02 24:04:01"),
("2003-01-32 03:04:01"),("2003-13-02 03:04:01"), ("10000-12-02 03:04:00");
ERROR HY000: Received an invalid datetime value '2003-01-02 03:63:01'.
select * from t1;
t
delete from t1;
insert into t1 values ("0000-00-00 00:00:00 some trailer"),("2003-01-01 00:00:00 some trailer");
ERROR HY000: Received an invalid datetime value '0000-00-00 00:00:00 some trailer'.
select * from t1 order by t;
t
drop table t1;
create table t1 (dt datetime primary key);
insert into t1 values ("12-01-01"), ("01-01-01 01:00:00");
insert into t1 values ("00-00-00"), ("00-00-00 00:00:00");
ERROR HY000: Received an invalid datetime value '00-00-00'.
select * from t1;
dt
2001-01-01 01:00:00
2012-01-01 00:00:00
drop table t1;
select cast('2006-12-05 22:10:10' as datetime) + 0;
cast('2006-12-05 22:10:10' as datetime) + 0
20061205221010.000000
CREATE TABLE t1(a DATETIME NOT NULL primary key);
INSERT INTO t1 VALUES ('20060606155555');
SELECT a FROM t1 WHERE a=(SELECT MAX(a) FROM t1) AND (a="20060606155555");
a
2006-06-06 15:55:55
DROP TABLE t1;
SELECT CAST(CAST('2006-08-10' AS DATE) AS DECIMAL(20,6));
CAST(CAST('2006-08-10' AS DATE) AS DECIMAL(20,6))
20060810.000000
SELECT CAST(CAST('2006-08-10 10:11:12' AS DATETIME) AS DECIMAL(20,6));
CAST(CAST('2006-08-10 10:11:12' AS DATETIME) AS DECIMAL(20,6))
20060810101112.000000
SELECT CAST(CAST('2006-08-10 10:11:12' AS DATETIME) + INTERVAL 14 MICROSECOND AS DECIMAL(20,6));
CAST(CAST('2006-08-10 10:11:12' AS DATETIME) + INTERVAL 14 MICROSECOND AS DECIMAL(20,6))
20060810101112.000014
create table t1 (da date default '1962-03-03 23:33:34', dt datetime default '1962-03-03', pk int primary key auto_increment);
show create table t1;
Table	Create Table
t1	CREATE TABLE `t1` (
  `da` DATE DEFAULT '1962-03-03',
  `dt` DATETIME DEFAULT '1962-03-03 00:00:00.000000',
  `pk` INT NOT NULL AUTO_INCREMENT,
  PRIMARY KEY (`pk`) USING BTREE
) ENGINE=DEFAULT COLLATE = utf8_general_ci
insert into t1 values ();
insert into t1 (da, dt) values ('2007-03-23 13:49:38','2007-03-23 13:49:38');
insert into t1 (da, dt) values ('2007-03-23 13:49:38','2007-03-23 13:49:38');
insert into t1 set dt='2007-03-23 13:49:38',da=dt;
insert into t1 (da, dt) values ('2007-03-32','2007-03-23 13:49:38');
ERROR HY000: Received an invalid DATE value '2007-03-32'.
select da,dt from t1;
da	dt
1962-03-03	1962-03-03 00:00:00
2007-03-23	2007-03-23 13:49:38
2007-03-23	2007-03-23 13:49:38
2007-03-23	2007-03-23 13:49:38
drop table t1;
create table t1 (da date default '1962-03-32 23:33:34', dt datetime default '1962-03-03', pk int auto_increment primary key);
ERROR HY000: Received an invalid datetime value '1962-03-32 23:33:34'.
create table t1 (f1 date, f2 datetime, f3 timestamp, primary key (f1,f2));
insert into t1 values('2001-01-01','2001-01-01 01:01:01','2001-01-01 01:01:01');
insert into t1 values('2001-02-05','2001-02-05 00:00:00','2001-02-05 01:01:01');
insert into t1 values('2001-03-10','2001-03-09 01:01:01','2001-03-10 01:01:01');
insert into t1 values('2001-04-15','2001-04-15 00:00:00','2001-04-15 00:00:00');
insert into t1 values('2001-05-20','2001-05-20 01:01:01','2001-05-20 01:01:01');
select f2 from t1 where f2 between '2001-2-5' and '01-04-14';
f2
2001-02-05 00:00:00
2001-03-09 01:01:01
select f1, f2, f3 from t1 where f1 between f2 and f3;
f1	f2	f3
2001-02-05	2001-02-05 00:00:00	2001-02-05 01:01:01
2001-03-10	2001-03-09 01:01:01	2001-03-10 01:01:01
2001-04-15	2001-04-15 00:00:00	2001-04-15 00:00:00
select f1, f2, f3 from t1 where cast(f1 as datetime) between f2 and
cast(f3 as date);
f1	f2	f3
2001-02-05	2001-02-05 00:00:00	2001-02-05 01:01:01
2001-03-10	2001-03-09 01:01:01	2001-03-10 01:01:01
2001-04-15	2001-04-15 00:00:00	2001-04-15 00:00:00
select f2 from t1 where '2001-04-10 12:34:56' between f2 and '01-05-01';
f2
2001-01-01 01:01:01
2001-02-05 00:00:00
2001-03-09 01:01:01
select f2, f3 from t1 where '01-03-10' between f2 and f3;
f2	f3
2001-03-09 01:01:01	2001-03-10 01:01:01
select f2 from t1 where DATE(f2) between "2001-4-15" AND "01-4-15";
f2
2001-04-15 00:00:00
drop table t1;
create table t1 (f1 date primary key);
insert into t1 values('01-01-01'),('01-01-02'),('01-01-03');
select * from t1 where f1 in ('01-01-01','2001-01-02','2001-01-03 00:00:00');
f1
2001-01-01
2001-01-02
2001-01-03
create table t2(f2 datetime primary key);
insert into t2 values('01-01-01 00:00:00'),('01-02-03 12:34:56'),('02-04-06 11:22:33');
select * from t2 where f2 in ('01-01-01','01-02-03 12:34:56','01-02-03');
f2
2001-01-01 00:00:00
2001-02-03 12:34:56
select * from t1,t2 where '01-01-02' in (f1, cast(f2 as date));
f1	f2
2001-01-02	2001-01-01 00:00:00
2001-01-02	2001-02-03 12:34:56
2001-01-02	2002-04-06 11:22:33
select * from t1,t2 where '01-01-01' in (f1, '01-02-03');
f1	f2
2001-01-01	2001-01-01 00:00:00
2001-01-01	2001-02-03 12:34:56
2001-01-01	2002-04-06 11:22:33
select * from t1,t2 where if(1,'01-02-03 12:34:56','') in (f1, f2);
f1	f2
2001-01-01	2001-02-03 12:34:56
2001-01-02	2001-02-03 12:34:56
2001-01-03	2001-02-03 12:34:56
create table t3(f3 varchar(20) primary key);
insert into t3 select * from t2;
select * from t2,t3 where f2 in (f3,'03-04-05');
f2	f3
2001-01-01 00:00:00	2001-01-01 00:00:00
2001-02-03 12:34:56	2001-02-03 12:34:56
2002-04-06 11:22:33	2002-04-06 11:22:33
select f1,f2,f3 from t1,t2,t3 where (f1,'1') in ((f2,'1'),(f3,'1'));
f1	f2	f3
2001-01-01	2001-01-01 00:00:00	2001-01-01 00:00:00
2001-01-01	2001-02-03 12:34:56	2001-01-01 00:00:00
2001-01-01	2002-04-06 11:22:33	2001-01-01 00:00:00
2001-01-01	2001-01-01 00:00:00	2001-02-03 12:34:56
2001-01-01	2001-01-01 00:00:00	2002-04-06 11:22:33
select f1 from t1 where ('1',f1) in (('1','01-01-01'),('1','2001-1-1 0:0:0'),('1','02-02-02'));
f1
2001-01-01
drop table t1,t2,t3;
select least(cast('01-01-01' as date), '01-01-02');
least(cast('01-01-01' as date), '01-01-02')
2001-01-01
select greatest(cast('01-01-01' as date), '01-01-02');
greatest(cast('01-01-01' as date), '01-01-02')
01-01-02
select least(cast('01-01-01' as date), '01-01-02') + 0;
least(cast('01-01-01' as date), '01-01-02') + 0
20010101
select greatest(cast('01-01-01' as date), '01-01-02') + 0;
greatest(cast('01-01-01' as date), '01-01-02') + 0
20010102
select least(cast('01-01-01' as datetime), '01-01-02') + 0;
least(cast('01-01-01' as datetime), '01-01-02') + 0
20010101000000
select cast(least(cast('01-01-01' as datetime), '01-01-02') as decimal(16,2));
cast(least(cast('01-01-01' as datetime), '01-01-02') as decimal(16,2))
20010101000000.00
create table t1 (f1 date primary key);
insert into t1 values (curdate());
select left(f1,10) = curdate() from t1;
left(f1,10) = curdate()
1
drop table t1;
create table t1(f1 date, pk int auto_increment primary key);
insert into t1 (f1) values('01-01-01'),('02-02-02'),('01-01-01'),('02-02-02');
set @bug28261='';
select if(@bug28261 = f1, '', @bug28261:= f1) from t1;
if(@bug28261 = f1, '', @bug28261:= f1)
2001-01-01
2002-02-02
2001-01-01
2002-02-02
Warnings:
Warning	1292	Incorrect date value: '' for column 'f1' at row 1
select if(@bug28261 = f1, '', @bug28261:= f1) from t1;
if(@bug28261 = f1, '', @bug28261:= f1)
2001-01-01
2002-02-02
2001-01-01
2002-02-02
select if(@bug28261 = f1, '', @bug28261:= f1) from t1;
if(@bug28261 = f1, '', @bug28261:= f1)
2001-01-01
2002-02-02
2001-01-01
2002-02-02
drop table t1;
create table t1(f1 datetime primary key);
insert into t1 values('2001-01-01'),('2002-02-02');
select * from t1 where f1 between 20020101 and 20070101000000;
f1
2002-02-02 00:00:00
select * from t1 where f1 between 2002010 and 20070101000000;
ERROR HY000: Received an invalid datetime value '2002010'.
select * from t1 where f1 between 20020101 and 2007010100000;
ERROR HY000: Received an invalid datetime value '2007010100000'.
drop table t1;
create table t1 (a int, pk int primary key auto_increment);
insert into t1 values (), (), ();
select sum(a) from t1 group by convert(a, datetime);
sum(a)
NULL
drop table t1;
create table t1 (id int not null primary key, cur_date datetime not null);
create table t2 (id int not null primary key, cur_date date not null);
insert into t1 (id, cur_date) values (1, '2007-04-25 18:30:22');
insert into t2 (id, cur_date) values (1, '2007-04-25');
explain extended
select * from t2
where id in (select id from t2 as x1 where (t2.cur_date is null));
id	select_type	table	type	possible_keys	key	key_len	ref	rows	filtered	Extra
1	PRIMARY	t2	ALL	NULL	NULL	NULL	NULL	#	100.00	Using where
2	DEPENDENT SUBQUERY	NULL	NULL	NULL	NULL	NULL	NULL	#	NULL	Impossible WHERE
Warnings:
Note	1276	Field or reference 'test.t2.cur_date' of SELECT #2 was resolved in SELECT #1
Note	1003	select `test`.`t2`.`id` AS `id`,`test`.`t2`.`cur_date` AS `cur_date` from `test`.`t2` where <in_optimizer>(`test`.`t2`.`id`,<exists>(select 1 AS `Not_used` from `test`.`t2` `x1` where 0))
select * from t2
where id in (select id from t2 as x1 where (t2.cur_date is null));
id	cur_date
insert into t1 (id, cur_date) values (2, '2007-04-26 18:30:22');
insert into t2 (id, cur_date) values (2, '2007-04-26');
explain extended
select * from t1
where id in (select id from t1 as x1 where (t1.cur_date is null));
id	select_type	table	type	possible_keys	key	key_len	ref	rows	filtered	Extra
1	PRIMARY	t1	ALL	NULL	NULL	NULL	NULL	#	100.00	Using where
2	DEPENDENT SUBQUERY	NULL	NULL	NULL	NULL	NULL	NULL	#	NULL	Impossible WHERE
Warnings:
Note	1276	Field or reference 'test.t1.cur_date' of SELECT #2 was resolved in SELECT #1
Note	1003	select `test`.`t1`.`id` AS `id`,`test`.`t1`.`cur_date` AS `cur_date` from `test`.`t1` where <in_optimizer>(`test`.`t1`.`id`,<exists>(select 1 AS `Not_used` from `test`.`t1` `x1` where 0))
select * from t1
where id in (select id from t1 as x1 where (t1.cur_date is null));
id	cur_date
explain extended
select * from t2
where id in (select id from t2 as x1 where (t2.cur_date is null));
id	select_type	table	type	possible_keys	key	key_len	ref	rows	filtered	Extra
1	PRIMARY	t2	ALL	NULL	NULL	NULL	NULL	#	100.00	Using where
2	DEPENDENT SUBQUERY	NULL	NULL	NULL	NULL	NULL	NULL	#	NULL	Impossible WHERE
Warnings:
Note	1276	Field or reference 'test.t2.cur_date' of SELECT #2 was resolved in SELECT #1
Note	1003	select `test`.`t2`.`id` AS `id`,`test`.`t2`.`cur_date` AS `cur_date` from `test`.`t2` where <in_optimizer>(`test`.`t2`.`id`,<exists>(select 1 AS `Not_used` from `test`.`t2` `x1` where 0))
select * from t2
where id in (select id from t2 as x1 where (t2.cur_date is null));
id	cur_date
drop table t1,t2;
End of 5.0 tests
create table t1 (da date default '1962-03-03 23:33:34', dt datetime default '1962-03-03', pk int auto_increment primary key);
show create table t1;
Table	Create Table
t1	CREATE TABLE `t1` (
  `da` DATE DEFAULT '1962-03-03',
  `dt` DATETIME DEFAULT '1962-03-03 00:00:00.000000',
  `pk` INT NOT NULL AUTO_INCREMENT,
  PRIMARY KEY (`pk`) USING BTREE
) ENGINE=DEFAULT COLLATE = utf8_general_ci
insert into t1 values ();
insert into t1 (da, dt) values ('2007-03-23 13:49:38','2007-03-23 13:49:38');
insert into t1 (da, dt) values ('2007-03-23 13:49:38','2007-03-23 13:49:38');
insert into t1 set dt='2007-03-23 13:49:38',da=dt;
insert into t1 (da, dt) values ('2007-03-32','2007-03-23 13:49:38');
ERROR HY000: Received an invalid DATE value '2007-03-32'.
select da,dt from t1;
da	dt
1962-03-03	1962-03-03 00:00:00
2007-03-23	2007-03-23 13:49:38
2007-03-23	2007-03-23 13:49:38
2007-03-23	2007-03-23 13:49:38
drop table t1;
create table t1 (da date default '1962-03-32 23:33:34', dt datetime default '1962-03-03' primary key);
ERROR HY000: Received an invalid datetime value '1962-03-32 23:33:34'.
