DROP TABLE IF EXISTS a;
CREATE TABLE a (i int,  PRIMARY KEY (i));
INSERT INTO a VALUES (1);
INSERT INTO a VALUES (2);
UPDATE a SET i=9 WHERE i=2;
SELECT * FROM a ORDER BY i;
i
1
9
INSERT INTO a VALUES (3);
SELECT * FROM a ORDER BY i;
i
1
3
9
UPDATE a SET i=10 WHERE i=3;
DELETE FROM a WHERE i=10;
SELECT IF(COUNT_SELECT, "YES", "NO"), IF(COUNT_UPDATE, "YES", "NO"), IF(COUNT_INSERT, "YES", "NO") FROM DATA_DICTIONARY.CUMULATIVE_SQL_COMMANDS WHERE USERNAME != "root" ORDER BY USERNAME;
IF(COUNT_SELECT, "YES", "NO")	IF(COUNT_UPDATE, "YES", "NO")	IF(COUNT_INSERT, "YES", "NO")
YES	YES	YES
YES	YES	YES
SELECT USERNAME, IF(DENIED_CONNECTIONS, "NO", "YES"), IF(LOST_CONNECTIONS, "YES", "NO"), IF(DENIED_CONNECTIONS, "YES", "NO"),  IF(ROWS_FETCHED, "YES", "NO"), IF(ROWS_UPDATED, "YES", "NO"), IF(ROWS_INSERTED, "YES", "NO")  FROM DATA_DICTIONARY.CUMULATIVE_USER_STATS WHERE USERNAME != "root" ORDER BY USERNAME;
USERNAME	IF(DENIED_CONNECTIONS, "NO", "YES")	IF(LOST_CONNECTIONS, "YES", "NO")	IF(DENIED_CONNECTIONS, "YES", "NO")	IF(ROWS_FETCHED, "YES", "NO")	IF(ROWS_UPDATED, "YES", "NO")	IF(ROWS_INSERTED, "YES", "NO")
drizzle	YES	YES	NO	YES	YES	YES
drizzle_test	YES	YES	NO	YES	YES	YES
DROP TABLE a;
