create table t1 (a int);
insert into t1 values (1);
begin;
select a from t1 where a=1 for update;
a
1
update t1 set a=2 where a=1;
ERROR HY000: Lock wait timeout exceeded; try restarting transaction
commit;
select * from t1;
a
1
update t1 set a=2 where a=1;
select * from t1;
a
2
DROP TABLE t1;
